"key","title","creators","date","tags","citation","citationAuthor","bib"
"7BNBJBZB","The secret rules of the internet","Buni, Catherine;","2016-04-13T10:30:06-04:00","company actions,content moderation,disinformation,scale","Buni, “The Secret Rules of the Internet.”","(Buni 2016)","Buni, Catherine. “The Secret Rules of the Internet.” The Verge, April 13, 2016. https://www.theverge.com/2016/4/13/11387934/internet-moderator-history-youtube-facebook-reddit-censorship-free-speech."
"FHG4CNNI","Twitter's Chronological Timeline Will Save Us From Ourselves",,"","Facebook,company actions,disinformation","“Twitter’s Chronological Timeline Will Save Us From Ourselves.”","(_Wired_ n.d.)","“Twitter’s Chronological Timeline Will Save Us From Ourselves.” _Wired_. Accessed July 22, 2020. https://www.wired.com/story/twitter-chronological-timeline-will-save-us/."
"AIC7EN7U","Bringing People Closer Together",,"2018-01-12T00:31:44-08:00","Facebook,company actions,disinformation","“Bringing People Closer Together.”","(“Bringing People Closer Together” 2018)","About Facebook. “Bringing People Closer Together,” January 12, 2018. https://about.fb.com/news/2018/01/news-feed-fyi-bringing-people-closer-together/."
"7FJIM5WP","Making Ads and Pages More Transparent",,"2018-04-06T18:00:45-07:00","Facebook,company actions,disinformation","“Making Ads and Pages More Transparent.”","(“Making Ads and Pages More Transparent” 2018)","About Facebook. “Making Ads and Pages More Transparent,” April 6, 2018. https://about.fb.com/news/2018/04/transparent-ads-and-pages/."
"IAIRZ44H","Facebook Rules: Structures of Governance in Digital Capitalism and the Control of Generalized Social Capital","Schwarz, Ori;","July 1, 2019","attention maximization,causes,company actions,disinformation,targeted ads","Schwarz, “Facebook Rules.”","(Schwarz 2019)","Schwarz, Ori. “Facebook Rules: Structures of Governance in Digital Capitalism and the Control of Generalized Social Capital.” _Theory, Culture & Society_ 36, no. 4 (July 1, 2019): 117–41. https://doi.org/10.1177/0263276419826249."
"CWKPHP9B","The Daily You: How the New Advertising Industry Is Defining Your Identity and Your Worth","Turow, Joseph;","2012-01-10","causes,disinformation,targeted ads","Turow, _The Daily You_.","(Turow 2012)","Turow, Joseph. _The Daily You: How the New Advertising Industry Is Defining Your Identity and Your Worth_. Yale University Press, 2012."
"HJNWBKWN","Metrics at Work: Journalism and the Contested Meaning of Algorithms","Christin, Angèle;","2020-06-30","causes,decline of news,disinformation,targeted ads","Christin, _Metrics at Work_.","(Christin 2020)","Christin, Angèle. _Metrics at Work: Journalism and the Contested Meaning of Algorithms_. Princeton University Press, 2020."
"M6DC62GV","The Online Advertising Industry: Economics, Evolution, and Privacy","Evans, David S;","2009-08-01","causes,disinformation,targeted ads","Evans, “The Online Advertising Industry.”","(Evans 2009)","Evans, David S. “The Online Advertising Industry: Economics, Evolution, and Privacy.” _Journal of Economic Perspectives_ 23, no. 3 (August 1, 2009): 37–60. https://doi.org/10.1257/jep.23.3.37."
"SWVPJND8","UK publishers losing digital ad revenue due to content 'blacklists'","Sweney, Mark;","2020-01-20T06:00:18.000Z","decline of news,disinformation,targeted ads","Sweney, “UK Publishers Losing Digital Ad Revenue Due to Content ‘Blacklists.’”","(Sweney 2020)","Sweney, Mark. “UK Publishers Losing Digital Ad Revenue Due to Content ‘Blacklists.’” _The Guardian_, January 20, 2020, sec. Media. https://www.theguardian.com/media/2020/jan/20/uk-publishers-losing-digital-ad-revenue-due-to-content-blacklists."
"W8QBJ5IV","The Privacy Policymaking of State Attorneys General","Citron, Danielle Keats;","2016/02/16","disinformation,policy,privacy","Citron, “The Privacy Policymaking of State Attorneys General.”","(Citron 2016)","Citron, Danielle Keats. “The Privacy Policymaking of State Attorneys General.” SSRN Scholarly Paper. Rochester, NY: Social Science Research Network, February 16, 2016. https://papers.ssrn.com/abstract=2733297."
"4BT3CSGA","Testimony before the U.S. Senate Judiciary Committee","O'Kelley, Brian;","May 21, 2019","disinformation,policy,privacy","O’Kelley, “Testimony before the U.S. Senate Judiciary Committee.”","(O’Kelley 2019)","O’Kelley, Brian. “Testimony before the U.S. Senate Judiciary Committee,” May 21, 2019. https://www.judiciary.senate.gov/imo/media/doc/O’Kelley%20Testimony.pdf."
"H7UNCQGC","Innovation Matters | The MIT Press","Press, The MIT;","","","Press, “Innovation Matters | The MIT Press.”","(Press n.d.)","Press, The MIT. “Innovation Matters | The MIT Press.” Accessed July 13, 2020. https://mitpress.mit.edu/books/innovation-matters."
"Q7AP5G8X","Transparency in artificial intelligence","Larsson, Stefan;Heintz, Fredrik;","2020/5/5","","Larsson and Heintz, “Transparency in Artificial Intelligence.”","(Larsson and Heintz 2020)","Larsson, Stefan, and Fredrik Heintz. “Transparency in Artificial Intelligence.” _Internet Policy Review_ 9, no. 2 (May 5, 2020). https://policyreview.info/concepts/transparency-artificial-intelligence."
"AAB3KCWV","Facebook confessions: Corporate abdication and Silicon Valley dystopianism","Karppi, Tero;Nieborg, David B;","June 29, 2020","","Karppi and Nieborg, “Facebook Confessions.”","(Karppi and Nieborg 2020)","Karppi, Tero, and David B Nieborg. “Facebook Confessions: Corporate Abdication and Silicon Valley Dystopianism.” _New Media & Society_, June 29, 2020, 1461444820933549. https://doi.org/10.1177/1461444820933549."
"8KUVW9E3","Cyber Mobs, Disinformation, and Death Videos: The Internet As It Is (And As It Should Be)","Citron, Danielle Keats;","2019/08/09","attention maximization,causes,disinformation,reform section 230,section 230,targeted ads","Citron, “Cyber Mobs, Disinformation, and Death Videos.”","(Citron 2019)","Citron, Danielle Keats. “Cyber Mobs, Disinformation, and Death Videos: The Internet As It Is (And As It Should Be).” SSRN Scholarly Paper. Rochester, NY: Social Science Research Network, August 9, 2019. https://papers.ssrn.com/abstract=3435200."
"8M4VFMU6","Dissenting Statement of Commissioner Rohit Chopra Regarding the Matter of Facebook, Inc.","Chopra, Rohit;","2019-07-23T16:35:20-04:00","attention maximization,ban targeted ads,causes,disinformation,policy,targeted ads","Chopra, “Dissenting Statement of Commissioner Rohit Chopra Regarding the Matter of Facebook, Inc.”","(Chopra 2019)","Chopra, Rohit. “Dissenting Statement of Commissioner Rohit Chopra Regarding the Matter of Facebook, Inc.,” July 23, 2019. https://www.ftc.gov/public-statements/2019/07/dissenting-statement-commissioner-rohit-chopra-regarding-matter-facebook."
"BM8BCPIQ","Dark Patterns after the GDPR: Scraping Consent Pop-ups and Demonstrating their Influence","Nouwens, Midas;Liccardi, Ilaria;Veale, Michael;Karger, David;Kagal, Lalana;","2020-01-08","Computer Science - Computers and Society,Computer Science - Human-Computer Interaction,GDPR,Transparency,digital privacy,policy","Nouwens et al., “Dark Patterns after the GDPR.”","(Nouwens et al. 2020)","Nouwens, Midas, Ilaria Liccardi, Michael Veale, David Karger, and Lalana Kagal. “Dark Patterns after the GDPR: Scraping Consent Pop-Ups and Demonstrating Their Influence.” _ArXiv:2001.02479 \[Cs\]_, January 8, 2020. https://doi.org/10.1145/3313831.3376321."
"DHB868AC","History of Fake News","Burkhardt, Joanna M.;","2017-11","causes,disinformation,history","Burkhardt, “History of Fake News.”","(Burkhardt 2017)","Burkhardt, Joanna M. “History of Fake News.” _Library Technology Reports_, Combatting Fake News in the Digital Age, 53, no. 8 (November 2017): 5. http://search.proquest.com/docview/1967322040/abstract/1B65E39B518443C6PQ/1."
"WMUW3TJK","Meet Larry Cook, the Villain Behind the Facebook Anti-Vaxx Scandal","Francis, Lizzy;","2020-02-11T16:45:13+00:00","causes,disinformation","Francis, “Meet Larry Cook, the Villain Behind the Facebook Anti-Vaxx Scandal.”","(Francis 2020)","Francis, Lizzy. “Meet Larry Cook, the Villain Behind the Facebook Anti-Vaxx Scandal.” Fatherly, February 11, 2020. https://www.fatherly.com/news/meet-larry-cook-the-villain-behind-the-facebook-anti-vaxx-scandal/."
"43XU3J3D","Down the rabbit hole: how QAnon conspiracies thrive on Facebook","Wong, Julia Carrie;","2020-06-25T10:00:42.000Z","Facebook,account removals,causes,content algorithms,disinformation","Wong, “Down the Rabbit Hole.”","(Wong 2020)","Wong, Julia Carrie. “Down the Rabbit Hole: How QAnon Conspiracies Thrive on Facebook.” _The Guardian_, June 25, 2020, sec. Technology. https://www.theguardian.com/technology/2020/jun/25/qanon-facebook-conspiracy-theories-algorithm."
"2W4GREGA","The Implied Truth Effect: Attaching Warnings to a Subset of Fake News Headlines Increases Perceived Accuracy of Headlines Without Warnings","Pennycook, Gordon;Bear, Adam;Collins, Evan T.;Rand, David G.;","February 21, 2020","company actions,disinformation,fact checking","Pennycook et al., “The Implied Truth Effect.”","(Pennycook et al. 2020)","Pennycook, Gordon, Adam Bear, Evan T. Collins, and David G. Rand. “The Implied Truth Effect: Attaching Warnings to a Subset of Fake News Headlines Increases Perceived Accuracy of Headlines Without Warnings.” _Management Science_, February 21, 2020. https://doi.org/10.1287/mnsc.2019.3478."
"4CK79XT7","Tackling misinformation in an open society","Staines, Cassie;Moy, Will;","Oct. 2018","ad transparency,policy,political ads","Staines and Moy, “Tackling Misinformation in an Open Society.”","(Staines and Moy 2018)","Staines, Cassie, and Will Moy. “Tackling Misinformation in an Open Society.” Full Fact, October 2018. https://fullfact.org/blog/2018/oct/tackling-misinformation-open-society/."
"CM5ZZCTR","Comment of Commissioner Rohit Chopra on Hearing #1 on Competition and Consumer Protection in the 21st Century","Chopra, Rohit;","2018-09-06T13:55:41-04:00","antitrust,competition regulations,policy","Chopra, “Comment of Commissioner Rohit Chopra on Hearing #1 on Competition and Consumer Protection in the 21st Century.”","(Chopra 2018)","Chopra, Rohit. “Comment of Commissioner Rohit Chopra on Hearing #1 on Competition and Consumer Protection in the 21st Century,” September 6, 2018. https://www.ftc.gov/public-statements/2018/09/comment-commissioner-rohit-chopra-hearing-1-competition-consumer."
"T85CETAN","Exposure to opposing views on social media can increase political polarization","Bail, Christopher A.;Argyle, Lisa P.;Brown, Taylor W.;Bumpus, John P.;Chen, Haohan;Hunzaker, M. B. Fallin;Lee, Jaemin;Mann, Marcus;Merhout, Friedolin;Volfovsky, Alexander;","2018/09/11","company actions,disinformation","Bail et al., “Exposure to Opposing Views on Social Media Can Increase Political Polarization.”","(Bail et al. 2018)","Bail, Christopher A., Lisa P. Argyle, Taylor W. Brown, John P. Bumpus, Haohan Chen, M. B. Fallin Hunzaker, Jaemin Lee, Marcus Mann, Friedolin Merhout, and Alexander Volfovsky. “Exposure to Opposing Views on Social Media Can Increase Political Polarization.” _Proceedings of the National Academy of Sciences_ 115, no. 37 (September 11, 2018): 9216–21. https://doi.org/10.1073/pnas.1804840115."
"A6XAVIA2","Section 230 — Nurturing Innovation or Fostering Unaccountability?",,"","reform section 230,section 230","“Section 230 — Nurturing Innovation or Fostering Unaccountability?”","(“Section 230 — Nurturing Innovation or Fostering Unaccountability?,” n.d.)","“Section 230 — Nurturing Innovation or Fostering Unaccountability?” U.S. DEPARTMENT OF JUSTICE, n.d. https://cdn.arstechnica.net/wp-content/uploads/2020/06/6-16-20section230keytakeawaysrecommendations.pdf."
"8D9IBRMA","How the Facebook Algorithm Works in 2020 and How to Work With It",,"2020-01-27T18:30:00+00:00","attention maximization,content algorithms,disinformation","“How the Facebook Algorithm Works in 2020 and How to Work With It.”","(“How the Facebook Algorithm Works in 2020 and How to Work With It” 2020)","Hootsuite Social Media Management. “How the Facebook Algorithm Works in 2020 and How to Work With It,” January 27, 2020. https://blog.hootsuite.com/facebook-algorithm/."
"NUVRRNIG","The Future of Political Campaigning","Bartlett, Jamie;Smith, Josh;Acton, Rose;","July 2018","disinformation,political ads,political exploitation","Bartlett, Smith, and Acton, “The Future of Political Campaigning.”","(Bartlett, Smith, and Acton 2018)","Bartlett, Jamie, Josh Smith, and Rose Acton. “The Future of Political Campaigning.” DEMOS, July 2018. https://demosuk.wpengine.com/wp-content/uploads/2018/07/The-Future-of-Political-Campaigning.pdf."
"95KTZXZD","Weaponizing the Digital Influence Machine","Nadler, Anthony;Donovan, Joan;Crain, Matthew;","2018/10/17","ad transparency,causes,decline of news,digital influence machine,disinformation,policy,political ads,political exploitation,surveillance capitalism,targeted ads,trust in news","Nadler, Donovan, and Crain, “Weaponizing the Digital Influence Machine.”","(Nadler, Donovan, and Crain 2018)","Nadler, Anthony, Joan Donovan, and Matthew Crain. “Weaponizing the Digital Influence Machine.” Data & Society, October 17, 2018. https://datasociety.net/library/weaponizing-the-digital-influence-machine/."
"6BD378CN","The Decline of Media Diversity — and How We Can Save It","Docquir, Pierre Francois;Stansi, Maria;","January 21, 2020","disinformation,must carry,policy,support news,unbundling","Docquir and Stansi, “The Decline of Media Diversity — and How We Can Save It.”","(Docquir and Stansi 2020)","Docquir, Pierre Francois, and Maria Stansi. “The Decline of Media Diversity — and How We Can Save It.” Centre for International Governance Innovation, January 21, 2020. https://www.cigionline.org/articles/decline-media-diversity-and-how-we-can-save-it."
"TZ7Q7GW5","Covid conspiracies and confusions: the impact on compliance with the UK’s lockdown rules and the link with social media use","Duffy, Bobby;Allington, Daniel;","June 18, 2020","COVID-19,disinformation,evidence","Duffy and Allington, “Covid Conspiracies and Confusions: The Impact on Compliance with the UK’s Lockdown Rules and the Link with Social Media Use.”","(Duffy and Allington 2020)","Duffy, Bobby, and Daniel Allington. “Covid Conspiracies and Confusions: The Impact on Compliance with the UK’s Lockdown Rules and the Link with Social Media Use.” The Policy Institute: Kings College London, June 18, 2020. https://www.kcl.ac.uk/policy-institute/assets/covid-conspiracies-and-confusions.pdf."
"575GSAMD","Code: And Other Laws of Cyberspace","Lessig, Lawrence;","1999","Business & Economics / Industries / Media & Communications,Introduction,Language Arts & Disciplines / Communication Studies,Self-rule fallacy","Lessig, _Code_.","(Lessig 1999)","Lessig, Lawrence. _Code: And Other Laws of Cyberspace_. Basic Books, 1999."
"HPEPITTK","How Internet Platforms Are Combating Disinformation and Misinformation in the Age of COVID-19","Singh, Spandana;Bagchi, Koustubh;","June 1, 2020","Amazon,COVID-19,Facebook,Google,Reddit,TikTok,Twitter,WhatsApp,YouTube,company actions,disinformation","Singh and Bagchi, “How Internet Platforms Are Combating Disinformation and Misinformation in the Age of COVID-19.”","(Singh and Bagchi 2020)","Singh, Spandana, and Koustubh Bagchi. “How Internet Platforms Are Combating Disinformation and Misinformation in the Age of COVID-19.” New America, June 1, 2020. http://newamerica.org/oti/reports/how-internet-platforms-are-combating-disinformation-and-misinformation-age-covid-19/."
"DYM9L9KC","Inside Nextdoor’s ""Karen problem""","Kelly, Makena;","2020-06-08T13:44:36-04:00","NextDoor,bias,content moderation,racism","Kelly, “Inside Nextdoor’s ‘Karen Problem.’”","(Kelly 2020)","Kelly, Makena. “Inside Nextdoor’s ‘Karen Problem.’” The Verge, June 8, 2020. https://www.theverge.com/21283993/nextdoor-app-racism-community-moderation-guidance-protests."
"WEXMT92D","Leaving content moderation to volunteers is empowering racists","Newton, Casey;","2020-06-09T06:00:00-04:00","","Newton, “Leaving Content Moderation to Volunteers Is Empowering Racists.”","(Newton 2020)","Newton, Casey. “Leaving Content Moderation to Volunteers Is Empowering Racists.” The Verge, June 9, 2020. https://www.theverge.com/interface/2020/6/9/21283442/content-moderation-racism-facebook-reddit-nextdoor-karen."
"6XDQ6SFD","Getting to the Source of Infodemics: It’s the Business Model","Marechal, Nathalie;MacKinnon, Rebecca;Dheere, Jessica;","May 27, 2020","ban targeted ads,disinformation,policy,surveillance capitalism,targeted ads","Marechal, MacKinnon, and Dheere, “Getting to the Source of Infodemics.”","(Marechal, MacKinnon, and Dheere 2020)","Marechal, Nathalie, Rebecca MacKinnon, and Jessica Dheere. “Getting to the Source of Infodemics: It’s the Business Model.” Open Technology Institute, May 27, 2020. http://newamerica.org/oti/reports/getting-to-the-source-of-infodemics-its-the-business-model/."
"CLBBZ484","Facebook Enabled Advertisers to Reach ‘Jew Haters’","Angwin, Julia;Varner, Madeleine;Tobin, Ariana;","Sept. 14, 2017","Facebook,Hate groups,Hate speech,targeted ads","Angwin, Varner, and Tobin, “Facebook Enabled Advertisers to Reach ‘Jew Haters.’”","(Angwin, Varner, and Tobin 2017)","Angwin, Julia, Madeleine Varner, and Ariana Tobin. “Facebook Enabled Advertisers to Reach ‘Jew Haters.’” ProPublica, September 14, 2017. https://www.propublica.org/article/facebook-enabled-advertisers-to-reach-jew-haters."
"N7TICNFH","Investigation into data analytics for political purposes",,"November 6, 2018","","“Investigation into Data Analytics for Political Purposes.”","(“Investigation into Data Analytics for Political Purposes” 2018)","“Investigation into Data Analytics for Political Purposes.” Information Commissioner’s Office (UK), November 6, 2018. https://ico.org.uk/media/action-weve-taken/2260271/investigation-into-the-use-of-data-analytics-in-political-campaigns-final-20181105.pdf."
"2E48WE45","Rhet Ops",,"","","“Rhet Ops.”","(“Rhet Ops” n.d.)","University of Pittsburgh Press. “Rhet Ops.” Accessed May 28, 2020. https://upittpress.org/books/9780822945895/."
"S6HF4BRS","Artificial intelligence, tech corporate governance and the public interest regulatory response","Dignam, Alan;","2020/05/15","","Dignam, “Artificial Intelligence, Tech Corporate Governance and the Public Interest Regulatory Response.”","(Dignam 2020)","Dignam, Alan. “Artificial Intelligence, Tech Corporate Governance and the Public Interest Regulatory Response.” _Cambridge Journal of Regions, Economy and Society_ 13, no. 1 (May 15, 2020): 37–54. https://doi.org/10.1093/cjres/rsaa002."
"6N66BN2J","The Magical Theory of PoliticsMemes, Magic, and the Enchantment of Social Forces in the American Magic War","Asprem, Egil;","2020/04/15","","Asprem, “The Magical Theory of PoliticsMemes, Magic, and the Enchantment of Social Forces in the American Magic War.”","(Asprem 2020)","Asprem, Egil. “The Magical Theory of PoliticsMemes, Magic, and the Enchantment of Social Forces in the American Magic War.” _Nova Religio_ 23, no. 4 (April 15, 2020): 15–42. https://doi.org/10.1525/nr.2020.23.4.15."
"HA9EKH2B","The New Age of Hybridity and Clash of Norms: China, BRICS, and Challenges of Global Governance in a Postliberal International Order","Öniş, Ziya;Kutlay, Mustafa;","May 6, 2020","","Öniş and Kutlay, “The New Age of Hybridity and Clash of Norms.”","(Öniş and Kutlay 2020)","Öniş, Ziya, and Mustafa Kutlay. “The New Age of Hybridity and Clash of Norms: China, BRICS, and Challenges of Global Governance in a Postliberal International Order.” _Alternatives_, May 6, 2020, 0304375420921086. https://doi.org/10.1177/0304375420921086."
"WA4EGTN3","The Rise of Content Cartels","Douek, Evelyn;","2020/02/01","election interference,free speech,online governance,social media,tech platforms,terrorist content","Douek, “The Rise of Content Cartels.”","(Douek 2020)","Douek, Evelyn. “The Rise of Content Cartels.” SSRN Scholarly Paper. Rochester, NY: Social Science Research Network, February 1, 2020. https://papers.ssrn.com/abstract=3572309."
"WMDW4XDU","The Big Nine",,"2019-06-04T07:02:54+00:00","","_The Big Nine_.","(_The Big Nine_ 2019)","_The Big Nine_, 2019. https://www.publicaffairsbooks.com/titles/amy-webb/the-big-nine/9781541773738/."
"ZB87326M","The Platform Political Economy of FinTech: Reintermediation, Consolidation and Capitalisation","Langley, Paul;Leyshon, Andrew;","May 20, 2020","FinTech,capitalisation,consolidation,platform capitalism,reintermedation","Langley and Leyshon, “The Platform Political Economy of FinTech.”","(Langley and Leyshon 2020)","Langley, Paul, and Andrew Leyshon. “The Platform Political Economy of FinTech: Reintermediation, Consolidation and Capitalisation.” _New Political Economy_ 0, no. 0 (May 20, 2020): 1–13. https://doi.org/10.1080/13563467.2020.1766432."
"WWBHS5W8","Rhythmedia: A Study of Facebook Immune System","Carmi, Elinor;","May 16, 2020","","Carmi, “Rhythmedia.”","(Carmi 2020)","Carmi, Elinor. “Rhythmedia: A Study of Facebook Immune System.” _Theory, Culture & Society_, May 16, 2020, 0263276420917466. https://doi.org/10.1177/0263276420917466."
"MR5M2EP6","Consumption, Capital, and Class in Digital Space: The Political Economy of Pay-per-Click Business Models","Azhar, Shahram;","May 20, 2020","Audience Labor,Digital Capitalism,Immaterial Labor,Karl Marx,Value Theory","Azhar, “Consumption, Capital, and Class in Digital Space.”","(Azhar 2020)","Azhar, Shahram. “Consumption, Capital, and Class in Digital Space: The Political Economy of Pay-per-Click Business Models.” _Rethinking Marxism_ 0, no. 0 (May 20, 2020): 1–21. https://doi.org/10.1080/08935696.2020.1750196."
"VTTK3IKM","The smog of ignorance: Knowledge and wisdom in postnormal times","Sardar, Ziauddin;","June 1, 2020","AI,Big data,DIKW hierarchy,Ignorance,Information,Knowledge,Postnormal times,Unthought,Wisdom","Sardar, “The Smog of Ignorance.”","(Sardar 2020)","Sardar, Ziauddin. “The Smog of Ignorance: Knowledge and Wisdom in Postnormal Times.” _Futures_ 120 (June 1, 2020): 102554. https://doi.org/10.1016/j.futures.2020.102554."
"5427FKUS","Are machines stealing our jobs?","Gentili, Andrea;Compagnucci, Fabiano;Gallegati, Mauro;Valentini, Enzo;","2020/05/15","","Gentili et al., “Are Machines Stealing Our Jobs?”","(Gentili et al. 2020)","Gentili, Andrea, Fabiano Compagnucci, Mauro Gallegati, and Enzo Valentini. “Are Machines Stealing Our Jobs?” _Cambridge Journal of Regions, Economy and Society_ 13, no. 1 (May 15, 2020): 153–73. https://doi.org/10.1093/cjres/rsz025."
"IDTS346M","Network Theory| The Flip Side of Metcalfe’s Law: Multiple and Growing Costs of Network Exclusion","Tongia, Rahul;Wilson, Ernest J.;","2011","","Tongia and Wilson, “Network Theory| The Flip Side of Metcalfe’s Law.”","(Tongia and Wilson 2011)","Tongia, Rahul, and Ernest J. Wilson. “Network Theory| The Flip Side of Metcalfe’s Law: Multiple and Growing Costs of Network Exclusion,” 2011. https://www.semanticscholar.org/paper/Network-Theory%7C-The-Flip-Side-of-Metcalfe%E2%80%99s-Law%3A-of-Tongia-Wilson/7eb4eb2eafe9868636c9bd376804a462604e4a95."
"6WGUIRK9","Addressing Facebook and Google’s Harms Through a Regulated Competition Approach","Stoller, Matt;Miller, Sarah;Teachout, Zephyr;","April 10, 2020","Interoperability,abusive business practices,ad taxes,antitrust,ban targeted ads,competition regulations,digital privacy,disinformation,do not track,fake news,intermediary liability,misinformation,policy","Stoller, Miller, and Teachout, “Addressing Facebook and Google’s Harms Through a Regulated Competition Approach.”","(Stoller, Miller, and Teachout 2020)","Stoller, Matt, Sarah Miller, and Zephyr Teachout. “Addressing Facebook and Google’s Harms Through a Regulated Competition Approach.” American Economic Liberties Project, April 10, 2020. https://www.economicliberties.us/our-work/addressing-facebook-and-googles-harms-through-a-regulated-competition-approach/."
"FDQM6MEU","It’s Time to Tax Big Tech’s Data",,"","","“It’s Time to Tax Big Tech’s Data.”","(“It’s Time to Tax Big Tech’s Data” n.d.)","“It’s Time to Tax Big Tech’s Data.” Accessed May 16, 2020. https://tribunemag.co.uk/2020/05/its-time-to-tax-big-techs-data."
"I5KWA5SV","The Republic of Facebook",,"2020-05-06T17:05:12+00:00","","“The Republic of Facebook.”","(“The Republic of Facebook” 2020)","Just Security. “The Republic of Facebook,” May 6, 2020. https://www.justsecurity.org/70035/the-republic-of-facebook/."
"C9RDCVBG","Why We Need Cooperatives for the Digital Economy",,"","","“Why We Need Cooperatives for the Digital Economy.”","(“Why We Need Cooperatives for the Digital Economy” n.d.)","“Why We Need Cooperatives for the Digital Economy.” Accessed May 16, 2020. https://jacobinmag.com/2020/05/cooperatives-digital-economy-airbnb-cities."
"DA9J6X2E","Lie machines: how to save democracy from troll armies, deceitful robots, junk news operations, and political operatives","Howard, Philip N.;","2020","","Howard, _Lie Machines_.","(Howard 2020)","Howard, Philip N. _Lie Machines: How to Save Democracy from Troll Armies, Deceitful Robots, Junk News Operations, and Political Operatives_. New Haven: Yale University Press, 2020."
