"key","title","creators","date","tags","citation","citationAuthor","bib"
"RMWMUWWD","Protecting Democracy and Public Health from Online Disinformation","Kornbluh, Karen;","2020-11-19T13:15:40-05:00","disinformaiton,policy paper,resource","Kornbluh, “Protecting Democracy and Public Health from Online Disinformation.”","(Kornbluh 2020)","Kornbluh, Karen. “Protecting Democracy and Public Health from Online Disinformation.” The German Marshall Fund of the United States, November 19, 2020. https://www.gmfus.org/publications/protecting-democracy-and-public-health-online-disinformation."
"GURFI3MI","Can Killing Cookies Save Journalism?","Edelman, Gilad;","August 5, 2020","ban targeted ads,disinformation,support news,targeted ads","Edelman, “Can Killing Cookies Save Journalism?”","(Edelman 2020)","Edelman, Gilad. “Can Killing Cookies Save Journalism?” _Wired_, August 5, 2020. https://www.wired.com/story/can-killing-cookies-save-journalism/."
"TLXGY7LV","The Internet Will Not Break: Denying Bad Samaritans Section 230 Immunity","Citron, Danielle Keats;Wittes, Benjamin;","2017/07/24","company actions,disinformation,policy,reform section 230,section 230","Citron and Wittes, “The Internet Will Not Break.”","(Citron and Wittes 2017)","Citron, Danielle Keats, and Benjamin Wittes. “The Internet Will Not Break: Denying Bad Samaritans Section 230 Immunity,” U of Maryland Legal Studies Research Paper, no. 2017–22 (July 24, 2017). https://papers.ssrn.com/abstract=3007720."
"EJHNNII7","The Problem Isn't Just Backpage: Revising Section 230 Immunity","Citron, Danielle Keats;Wittes, Benjamin;","July 2018","disinformation,policy,reform section 230,section 230","Citron and Wittes, “The Problem Isn’t Just Backpage.”","(Citron and Wittes 2018)","Citron, Danielle Keats, and Benjamin Wittes. “The Problem Isn’t Just Backpage: Revising Section 230 Immunity.” _Georgetown Law Technology Review_ 453 (July 2018). https://papers.ssrn.com/abstract=3218521."
"G7JZKP2F","The Internet As a Speech Machine and Other Myths Confounding Section 230 Reform","Citron, Danielle Keats;Franks, Mary Anne;","2020/02/01","disinformation,policy,section 230","Citron and Franks, “The Internet As a Speech Machine and Other Myths Confounding Section 230 Reform.”","(Citron and Franks 2020)","Citron, Danielle Keats, and Mary Anne Franks. “The Internet As a Speech Machine and Other Myths Confounding Section 230 Reform,” Boston Univ. School of Law, Public Law Research Paper, no. 20–8 (February 1, 2020). https://papers.ssrn.com/abstract=3532691."
"K3QRV6H7","Advancing Digital Trust with Privacy Rules and Accountability","Palfrey, Quentin;","2020-11-19T12:56:02-05:00","policy paper,privacy,resource","Palfrey, “Advancing Digital Trust with Privacy Rules and Accountability.”","(Palfrey 2020)","Palfrey, Quentin. “Advancing Digital Trust with Privacy Rules and Accountability.” The German Marshall Fund of the United States, November 19, 2020. https://www.gmfus.org/publications/advancing-digital-trust-privacy-rules-and-accountability."
"TKMPDCDU","Building Civic Infrastructure for the 21st Century","Goodman, Ellen P.;","2020-11-19T12:48:13-05:00","disinformation,policy paper,resource,support news","Goodman, “Building Civic Infrastructure for the 21st Century.”","(Goodman 2020)","Goodman, Ellen P. “Building Civic Infrastructure for the 21st Century.” The German Marshall Fund of the United States, November 19, 2020. https://www.gmfus.org/publications/building-civic-infrastructure-21st-century."
"C68U3RTT","A banner year for advertising and a look at differences across platforms","Neumann, Markus;Yao, Jielu;Dean, Spencer;Fowler, Erika Franklin;","November 2020","disinformaiton,political ads,resource","Neumann et al., “A Banner Year for Advertising and a Look at Differences across Platforms.”","(Neumann et al. 2020)","Neumann, Markus, Jielu Yao, Spencer Dean, and Erika Franklin Fowler. “A Banner Year for Advertising and a Look at Differences across Platforms.” _Election Analysis - United States_ (blog), November 2020. https://www.electionanalysis.ws/us/president2020/section-5-social-media/a-banner-year-for-advertising-and-a-look-at-differences-across-platforms/."
"HNZUU4KS","Big Other: Surveillance Capitalism and the Prospects of an Information Civilization","Zuboff, Shoshana;","2015","attention maximization,causes,disinformation,surveillance capitalism,targeted ads","Zuboff, “Big Other.”","(Zuboff 2015)","Zuboff, Shoshana. “Big Other: Surveillance Capitalism and the Prospects of an Information Civilization.” _Journal of Information Technology_ 30 (2015): 75–89. https://papers.ssrn.com/abstract=2594754."
"7C2XQ5QR","Deplatforming: Following extreme Internet celebrities to Telegram and alternative social media","Rogers, Richard;","May 6, 2020","","Rogers, “Deplatforming.”","(Rogers 2020)","Rogers, Richard. “Deplatforming: Following Extreme Internet Celebrities to Telegram and Alternative Social Media.” _European Journal of Communication_, May 6, 2020. https://doi.org/10.1177/0267323120922066."
"QYGX3LTT","Democracy Disrupted? Personal information and political influence.",,"July 1, 2018","","“Democracy Disrupted? Personal Information and Political Influence.”","(“Democracy Disrupted? Personal Information and Political Influence.” 2018)","“Democracy Disrupted? Personal Information and Political Influence.,” July 1, 2018. https://ico.org.uk/media/action-weve-taken/2259369/democracy-disrupted-110718.pdf."
"VJBKJ6N4","Why Google Dominates Advertising Markets","Srinivasan, Dina;","2019/12/09","Google,antitrust,competition","Srinivasan, “Why Google Dominates Advertising Markets.”","(Srinivasan 2019)","Srinivasan, Dina. “Why Google Dominates Advertising Markets.” SSRN Scholarly Paper. Rochester, NY: Social Science Research Network, December 9, 2019. https://papers.ssrn.com/abstract=3500919."
"7HW43F4T","Facebook is now using AI to sort content for quicker moderation","Vincent, James;","2020-11-13T09:00:00-05:00","content moderation,disinformation,facebook,news","Vincent, “Facebook Is Now Using AI to Sort Content for Quicker Moderation.”","(Vincent 2020)","Vincent, James. “Facebook Is Now Using AI to Sort Content for Quicker Moderation.” The Verge, November 13, 2020. https://www.theverge.com/2020/11/13/21562596/facebook-ai-moderation."
"W5WTXBRF","What Twitter Did After Trump Said Democrats Are Trying to “STEAL” the Election","Mak, Aaron;Bosch, Torie;","2020-11-03T23:19:17.509Z","disinformation,facebook,news,twitter","Mak and Bosch, “What Twitter Did After Trump Said Democrats Are Trying to ‘STEAL’ the Election.”","(Mak and Bosch 2020)","Mak, Aaron, and Torie Bosch. “What Twitter Did After Trump Said Democrats Are Trying to ‘STEAL’ the Election.” Slate, November 3, 2020. https://slate.com/technology/2020/11/election-day-2020-facebook-twitter-content-moderation-trump.html."
"UKSKXC9K","How Well Did Twitter, Facebook, and YouTube Handle Election Misinformation?","Kornbluh, Karen;Goodman, Ellen;","2020-11-11T00:12:15.414Z","content moderation,disinformation,election 2020,resource","Kornbluh and Goodman, “How Well Did Twitter, Facebook, and YouTube Handle Election Misinformation?”","(Kornbluh and Goodman 2020)","Kornbluh, Karen, and Ellen Goodman. “How Well Did Twitter, Facebook, and YouTube Handle Election Misinformation?” Slate, November 11, 2020. https://slate.com/technology/2020/11/twitter-facebook-youtube-misinformation-election.html."
"CVKZN6PV","Social media is making a bad political situation worse","Molla, Rani;","2020-11-10T13:10:00-05:00","content moderation,disinformation,election 2020,resource","Molla, “Social Media Is Making a Bad Political Situation Worse.”","(Molla 2020)","Molla, Rani. “Social Media Is Making a Bad Political Situation Worse.” Vox, November 10, 2020. https://www.vox.com/recode/21534345/polarization-election-social-media-filter-bubble."
"VGXV3BN2","YouTube is awash with election misinformation — and it isn’t taking it down","Heilweil, Rebecca;","2020-11-06T17:10:00-05:00","disinformation,news,youtube","Heilweil, “YouTube Is Awash with Election Misinformation — and It Isn’t Taking It down.”","(Heilweil 2020)","Heilweil, Rebecca. “YouTube Is Awash with Election Misinformation — and It Isn’t Taking It down.” Vox, November 6, 2020. https://www.vox.com/recode/21551696/stolen-election-misinformation-youtube-trump-voter-fraud."
"S34RCSH8","Mail-In Voter Fraud: Anatomy of a Disinformation Campaign","Benkler, Yochai;Tilton, Casey;Etling, Bruce;Roberts, Hal;Clark, Justin;Faris, Robert;Kaiser, Jonas;Schmitt, Carolyn;","2020/10/02","disinformation,filter bubbles,resource,selective exposure","Benkler et al., “Mail-In Voter Fraud.”","(Benkler et al. 2020)","Benkler, Yochai, Casey Tilton, Bruce Etling, Hal Roberts, Justin Clark, Robert Faris, Jonas Kaiser, and Carolyn Schmitt. “Mail-In Voter Fraud: Anatomy of a Disinformation Campaign.” Berkman Center Research Publication No. 2020-6, October 2, 2020. https://papers.ssrn.com/abstract=3703701."
"JATHQWWA","Trump allies, largely unconstrained by Facebook’s rules against repeated falsehoods, cement pre-election dominance","Stanley-Becker, Isaac;Dwoskin, Elizabeth;","November 1, 2020","content moderation,disinformation,fact checking,fact-checking","Stanley-Becker and Dwoskin, “Trump Allies, Largely Unconstrained by Facebook’s Rules against Repeated Falsehoods, Cement Pre-Election Dominance.”","(Stanley-Becker and Dwoskin 2020)","Stanley-Becker, Isaac, and Elizabeth Dwoskin. “Trump Allies, Largely Unconstrained by Facebook’s Rules against Repeated Falsehoods, Cement Pre-Election Dominance.” _Washington Post_, November 1, 2020. https://www.washingtonpost.com/technology/2020/11/01/facebook-election-misinformation/."
"7INBMUZK","Investigation of Competition in Digital Markets",,"October 2020","antitrust,disinformation,support news","“Investigation of Competition in Digital Markets.”","(“Investigation of Competition in Digital Markets” 2020)","“Investigation of Competition in Digital Markets.” Subcommittee on Antitrust, Commercial and Adminstrative Law of the Committee on the Judiciary, October 2020. https://judiciary.house.gov/uploadedfiles/competition\_in\_digital\_markets.pdf."
"X3FFN48H","Local Journalism: America’s Most Trusted News Sources Threatened",,"October 2020","antitrust,disinformation,resource,support news","“Local Journalism: America’s Most Trusted News Sources Threatened.”","(“Local Journalism: America’s Most Trusted News Sources Threatened” 2020)","“Local Journalism: America’s Most Trusted News Sources Threatened.” Ranking Member Maria Cantwell: U.S. Senate Committee on Commerce, Science, and Transportation, October 2020. https://cdn.arstechnica.net/wp-content/uploads/2020/10/Local-Journalism-Report-10.26.20\_430pm\_Draft.pdf."
"WBX34XW3","Facebook’s Content Moderation Errors Are Costing Africa Too Much","Ilori, Tomiwa;","2020-10-27T15:38:39.729Z","content moderation,content removal,disinformation","Ilori, “Facebook’s Content Moderation Errors Are Costing Africa Too Much.”","(Ilori 2020)","Ilori, Tomiwa. “Facebook’s Content Moderation Errors Are Costing Africa Too Much.” Slate Magazine, October 27, 2020. https://slate.com/technology/2020/10/facebook-instagram-endsars-protests-nigeria.html."
"I6NPG9U9","Letter to Facebook",,"August 6, 2018","ad transparency,disinformation","“Letter to Facebook.”","(“Letter to Facebook” 2018)","“Letter to Facebook.” The Knight First Amendment Institute, August 6, 2018. https://s3.amazonaws.com/kfai-documents/documents/d6ebc73dd9/Facebook\_Letter.pdf."
"XJAN5EEE","Researchers, Knight Institute Condemn Facebook Effort to Squelch Research on Disinformation",,"October 23, 2020","ad transparency,disinformation,political ads","“Researchers, Knight Institute Condemn Facebook Effort to Squelch Research on Disinformation.”","(“Researchers, Knight Institute Condemn Facebook Effort to Squelch Research on Disinformation” 2020)","Knight First Amendment Institute at Columbia University. “Researchers, Knight Institute Condemn Facebook Effort to Squelch Research on Disinformation,” October 23, 2020. https://knightcolumbia.org/content/researchers-knight-institute-condemn-facebook-effort-to-squelch-research-on-disinformation."
"QZDQHXHM","Facebook is trying to prevent NYU from examining its political ad-targeting. Researchers say they have no intention of stopping their work.","Grindell, Samantha;","October 24, 2020","ad transparency,disinformation,political ads","Grindell, “Facebook Is Trying to Prevent NYU from Examining Its Political Ad-Targeting. Researchers Say They Have No Intention of Stopping Their Work.”","(Grindell 2020)","Grindell, Samantha. “Facebook Is Trying to Prevent NYU from Examining Its Political Ad-Targeting. Researchers Say They Have No Intention of Stopping Their Work.” Business Insider, October 24, 2020. https://www.businessinsider.com/facebook-stopping-nyu-researchers-examining-political-ad-targeting-2020-10."
"P5CMPJAX","Canaries in the Coal Mine: COVID-19 Misinformation and Black Communities","Collins-Dexter, Brandi;","2020-06-24","COVID-19,disinformation,evidence","Collins-Dexter, “Canaries in the Coal Mine.”","(Collins-Dexter 2020)","Collins-Dexter, Brandi. “Canaries in the Coal Mine: COVID-19 Misinformation and Black Communities.” The Technology and Social Change Project: Shorenstein Center on Media, Politics and Public Policy, June 24, 2020. https://shorensteincenter.org/canaries-in-the-coal-mine/."
"PCX77N6M","As election looms, a network of mysterious ‘pink slime’ local news outlets nearly triples in size","Bengani, Priyanjana;","August 4, 2020","disinformation,support news","Bengani, “As Election Looms, a Network of Mysterious ‘Pink Slime’ Local News Outlets Nearly Triples in Size.”","(Bengani 2020)","Bengani, Priyanjana. “As Election Looms, a Network of Mysterious ‘Pink Slime’ Local News Outlets Nearly Triples in Size.” Columbia Journalism Review, August 4, 2020. https://www.cjr.org/analysis/as-election-looms-a-network-of-mysterious-pink-slime-local-news-outlets-nearly-triples-in-size.php."
"Z2JFD6ZN","Facebook Approved Ads With Coronavirus Misinformation","Waddell, Kaveh;","April 7, 2020","ad restrictions,ads,disinformation,resource","Waddell, “Facebook Approved Ads With Coronavirus Misinformation.”","(Waddell 2020)","Waddell, Kaveh. “Facebook Approved Ads With Coronavirus Misinformation.” Consumer Reports, April 7, 2020. https://www.consumerreports.org/social-media/facebook-approved-ads-with-coronavirus-misinformation/."
"R6GJ3WXT","Facebook Enabled Advertisers to Reach ‘Jew Haters’","Angwin, Julia;Varner, Madeleine;Tobin, Ariana;","September 14, 2017","ads,disinformation","Angwin, Varner, and Tobin, “Facebook Enabled Advertisers to Reach ‘Jew Haters.’”","(Angwin, Varner, and Tobin 2017)","Angwin, Julia, Madeleine Varner, and Ariana Tobin. “Facebook Enabled Advertisers to Reach ‘Jew Haters.’” ProPublica, September 14, 2017. https://www.propublica.org/article/facebook-enabled-advertisers-to-reach-jew-haters?token=1B8jKuq-H9G4ZEq4\_95FZ7ZaZ9a3rKDs."
"S9DXMCGI","Revealed: Facebook enables ads to target users interested in 'vaccine controversies'","Wong, Julia Carrie;","2019-02-15T18:59:43.000Z","ads,disinformation","Wong, “Revealed.”","(Wong 2019)","Wong, Julia Carrie. “Revealed: Facebook Enables Ads to Target Users Interested in ‘Vaccine Controversies.’” _The Guardian_, February 15, 2019, sec. Technology. https://www.theguardian.com/technology/2019/feb/15/facebook-anti-vaccination-advertising-targeting-controversy."
"RNUPRSKS","Removing Holocaust Denial Content",,"2020-10-12T14:00:38-07:00","","“Removing Holocaust Denial Content.”","(“Removing Holocaust Denial Content” 2020)","Facebook. “Removing Holocaust Denial Content,” October 12, 2020. https://about.fb.com/news/2020/10/removing-holocaust-denial-content/."
"48WB9K8J","Supporting Public Health Experts’ Vaccine Efforts",,"2020-10-13T16:00:24-07:00","Facebook,ad restrictions,content moderation,disinformation","“Supporting Public Health Experts’ Vaccine Efforts.”","(“Supporting Public Health Experts’ Vaccine Efforts” 2020)","Facebook. “Supporting Public Health Experts’ Vaccine Efforts,” October 13, 2020. https://about.fb.com/news/2020/10/supporting-public-health-experts-vaccine-efforts/."
"DGA5BBGQ","COVID-19 Medical Misinformation Policy - YouTube Help",,"May 20, 2020","Google,content moderation,content removal,disinformation","“COVID-19 Medical Misinformation Policy - YouTube Help.”","(“COVID-19 Medical Misinformation Policy - YouTube Help” 2020)","“COVID-19 Medical Misinformation Policy - YouTube Help,” May 20, 2020. https://support.google.com/youtube/answer/9891785."
"66AL2HCS","New Digital Realities; New Oversight Solutions in the U.S.","Wheeler, Tom;Verveer, Phil;Kimmelman, Gene;","August 20, 2020","antitrust,competition regulations,consumer protection,disinformation,duty of care,duty to deal,policy,privacy","Wheeler, Verveer, and Kimmelman, “New Digital Realities; New Oversight Solutions in the U.S.”","(Wheeler, Verveer, and Kimmelman 2020)","Wheeler, Tom, Phil Verveer, and Gene Kimmelman. “New Digital Realities; New Oversight Solutions in the U.S.” Harvard Kennedy School: Shorenstein Center on Media, Politics, and Public Policy, August 20, 2020. https://shorensteincenter.org/new-digital-realities-tom-wheeler-phil-verveer-gene-kimmelman/."
"T6JK47HH","Revealed: Trump campaign strategy to deter millions of Black Americans from voting in 2016",,"September 28, 2020","2016 election,disinformation,evidence,resource","“Revealed: Trump Campaign Strategy to Deter Millions of Black Americans from Voting in 2016.”","(“Revealed: Trump Campaign Strategy to Deter Millions of Black Americans from Voting in 2016” 2020)","“Revealed: Trump Campaign Strategy to Deter Millions of Black Americans from Voting in 2016.” United Kingdom, September 28, 2020. https://www.channel4.com/news/revealed-trump-campaign-strategy-to-deter-millions-of-black-americans-from-voting-in-2016."
"AF64NM9V","Dead Reckoning: Navigating Content Moderation After Fake News","Caplan, Robyn;Donovan, Joan;Hanson, Lauren;","February 2018","ban targeted ads,causes,content algorithms,content moderation,definition,demonetization,disinformation,fact-checking,fake news,resource","Caplan, Donovan, and Hanson, “Dead Reckoning: Navigating Content Moderation After Fake News.”","(Caplan, Donovan, and Hanson 2018)","Caplan, Robyn, Joan Donovan, and Lauren Hanson. “Dead Reckoning: Navigating Content Moderation After Fake News.” Data & Society, February 2018. https://datasociety.net/library/dead-reckoning/."
"PUR9PAEH","Information Disorder: The Definitional Toolbox","Wardle, Claire;","July 2018","definition,disinformation,featured,resource","Wardle, “Information Disorder.”","(Wardle 2018)","Wardle, Claire. “Information Disorder: The Definitional Toolbox.” First Draft News, July 2018. https://firstdraftnews.org:443/latest/infodisorder-definitional-toolbox/."
"PS8PGFP5","Information Disorder, Part 1: The Essential Glossary","Wardle, Claire;Greason, Grace;Kerwin, Joe;Dia, Nic;","Jul 2018","definition,disinformation","Wardle et al., “Information Disorder, Part 1: The Essential Glossary.”","(Wardle et al. 2018)","Wardle, Claire, Grace Greason, Joe Kerwin, and Nic Dia. “Information Disorder, Part 1: The Essential Glossary.” First Draft News, July 2018. https://firstdraftnews.org/wp-content/uploads/2018/07/infoDisorder\_glossary.pdf?x65316."
"RA4XNMNK","Demand Deceit: How the Way We Think Drives Disinformation","Wooley, Samuel;Joseff, Katie;","January 2020","Computational propaganda,active drivers,bots,causes,cognitive drivers,definition,demand,disinformation,echo chambers,featured,filter bubbles,passive drivers,psychological factors,resource,selective exposure","Wooley and Joseff, “How the Way We Think Drives Disinformation.”","(Wooley and Joseff 2020)","Wooley, Samuel, and Katie Joseff. “Demand Deceit: How the Way We Think Drives Disinformation.” Working Paper. National Endowment for Democracy & Institutional Forum for Democratic Studies, January 2020. https://www.ned.org/demand-for-deceit-how-way-we-think-drives-disinformation-samuel-woolley-katie-joseff/."
"C9569B35","TREASURY  LAWS AMENDENT  (NEWS MEDIA AND  DIGITAL PLATFORMS MANDATORY  BARGAININGCODE) BILL 2020",,"","disinformation","“TREASURY  LAWS AMENDENT  (NEWS MEDIA AND  DIGITAL PLATFORMS MANDATORY  BARGAININGCODE) BILL 2020.”","(“TREASURY  LAWS AMENDENT  (NEWS MEDIA AND  DIGITAL PLATFORMS MANDATORY  BARGAININGCODE) BILL 2020,” n.d.)","“TREASURY  LAWS AMENDENT  (NEWS MEDIA AND  DIGITAL PLATFORMS MANDATORY  BARGAININGCODE) BILL 2020.” Government of Australia, n.d."
"UGW6E23K","Facebook: Turn Off The Algorithms",,"","disinformation,solutions","“Facebook.”","(“Facebook: Turn Off The Algorithms” n.d.)","Accountable Tech. “Facebook: Turn Off The Algorithms.” Accessed September 10, 2020. https://accountabletech.org/campaign/facebook-turn-off-the-algorithms/."
"V4QZ85UU","Clearing up misconceptions about Google's ad tech business","Bitton, Daniel S.;Lewis, Stephen;","May 5, 2020","","Bitton and Lewis, “Clearing up Misconceptions about Google’s Ad Tech Business.”","(Bitton and Lewis 2020)","Bitton, Daniel S., and Stephen Lewis. “Clearing up Misconceptions about Google’s Ad Tech Business,” May 5, 2020. https://www.accc.gov.au/system/files/Google%20-%20Report%20from%20Daniel%20Bitton%20and%20Stephen%20Lewis%20%285%20May%202020%29.pdf."
"PIX3UX7M","Advertiser Controls",,"","Facebook,brand safety,targeted ads","“Advertiser Controls.”","(“Advertiser Controls” n.d.)","Facebook for Business. “Advertiser Controls.” Accessed August 28, 2020. https://www.facebook.com/business/tools/advertiser-controls."
"4EEWCUXV","Audience Network",,"","Facebook,targeted ads","“Audience Network.”","(“Audience Network” n.d.)","Facebook for Business. “Audience Network.” Accessed August 28, 2020. https://www.facebook.com/business/marketing/audience-network."
"B72Q4BWW","The Conspiracy Theory to Rule Them All","Zipperstein, Steven J.;","","disinformation","Zipperstein, “The Conspiracy Theory to Rule Them All.”","(Zipperstein n.d.)","Zipperstein, Steven J. “The Conspiracy Theory to Rule Them All.” _The Atlantic_. Accessed August 25, 2020. https://www.theatlantic.com/politics/archive/2020/08/conspiracy-theory-rule-them-all/615550/."
"F8DPXRJS","Apple's new iPhone operating system is making it harder for Facebook to track people, and Facebook says it will decimate part of its business","Price, Rob;","Aug. 26, 2020","Facebook,targeted ads","Price, “Apple’s New IPhone Operating System Is Making It Harder for Facebook to Track People, and Facebook Says It Will Decimate Part of Its Business.”","(Price 2020)","Price, Rob. “Apple’s New IPhone Operating System Is Making It Harder for Facebook to Track People, and Facebook Says It Will Decimate Part of Its Business.” _Business Insider_, August 26, 2020. https://www.businessinsider.com/facebook-apple-ios-14-damage-audience-network-ad-business-2020-8."
"N2WJBES4","AP Exclusive: Google tracks your movements, like it or not","Nakashima, Ryan;","2018-08-13T22:15:16Z","causes,opt out,privacy","Nakashima, “AP Exclusive.”","(Nakashima 2018)","Nakashima, Ryan. “AP Exclusive: Google Tracks Your Movements, like It or Not.” AP NEWS, August 13, 2018. https://apnews.com/828aefab64d4411bac257a07c1af0ecb."
"JUEH2HTX","Unredacted suit shows Google’s own engineers confused by privacy settings","Cox, Kate;","8/25/2020","causes,opt out,privacy","Cox, “Unredacted Suit Shows Google’s Own Engineers Confused by Privacy Settings.”","(Cox 2020)","Cox, Kate. “Unredacted Suit Shows Google’s Own Engineers Confused by Privacy Settings.” Ars Technica, August 25, 2020. https://arstechnica.com/tech-policy/2020/08/unredacted-suit-shows-googles-own-engineers-confused-by-privacy-settings/."
"P65BZ6BC","Online Tracking and Publishers Revenues: An Empirical Analysis","Marotta, Veronica;Abhishek, Vibhansu;Acquisti, Alessandro;","May 2019","ban targeted ads,disinformation,targeted ads","Marotta, Abhishek, and Acquisti, “Online Tracking and Publishers Revenues.”","(Marotta, Abhishek, and Acquisti 2019)","Marotta, Veronica, Vibhansu Abhishek, and Alessandro Acquisti. “Online Tracking and Publishers Revenues: An Empirical Analysis,” 2019. https://www.semanticscholar.org/paper/Online-Tracking-and-Publishers-Revenues%3A-An-Marotta/bee63f4551c7b6a5a1f07357734a81eab2fec919."
"GYL3JLCA","Like a virus: The coordinated spread of coronavirus disinformation","Graham, Timothy;Bruns, Axel;Zhu, Guangnan;Campbell, Rod;","May 2020","COVID-19,Twitter,disinformation,evidence","Graham et al., “Like a Virus: The Coordinated Spread of Coronavirus Disinformation.”","(Graham et al. 2020)","Graham, Timothy, Axel Bruns, Guangnan Zhu, and Rod Campbell. “Like a Virus: The Coordinated Spread of Coronavirus Disinformation.” Centre for Responsible Technology, The Australia Institute, May 2020. https://apo.org.au/node/305864."
"R232TXR4","Sarah Palin's Facebook grift","Legum, Judd;","July 28, 2020","disinformation,methods","Legum, “Sarah Palin’s Facebook Grift.”","(Legum 2020)","Legum, Judd. “Sarah Palin’s Facebook Grift.” Blog. Popular Information, July 28, 2020. https://popular.info/p/sarah-palins-facebook-grift."
