"key","title","creators","date","tags","citation","citationAuthor","bib"
"EWXK5M8W","How our misunderstanding of the digital and computing revolutions puts democracy at risk (and what to do about it)","Colaresi, Michael;","2020","","Colaresi, “How Our Misunderstanding of the Digital and Computing Revolutions Puts Democracy at Risk (and What to Do about It).”","(Colaresi 2020)","Colaresi, Michael. “How Our Misunderstanding of the Digital and Computing Revolutions Puts Democracy at Risk (and What to Do about It).” _Critical Quarterly_ 62, no. 1 (2020): 70–80. https://doi.org/10.1111/criq.12522."
"Z5QRVZVQ","Facebook Groups and YouTube enabled viral spread of Plandemic disinformation","Gallagher, Erin;","2020-05-10T00:11:20.026Z","COVID-19,Facebook,disinformation,evidence","Gallagher, “Facebook Groups and YouTube Enabled Viral Spread of Plandemic Disinformation.”","(Gallagher 2020)","Gallagher, Erin. “Facebook Groups and YouTube Enabled Viral Spread of Plandemic Disinformation.” Medium, May 10, 2020. https://medium.com/@erin\_gallagher/facebook-groups-and-youtube-enabled-viral-spread-of-plandemic-disinformation-f1a279335e8c."
"ECN2B8X9","Code Is Law","Lessig, Lawrence;","2000-01-01T07:00:00-05:00","Self-rule fallacy","Lessig, “Code Is Law.”","(Lessig 2000)","Lessig, Lawrence. “Code Is Law.” Harvard Magazine, January 1, 2000. https://harvardmagazine.com/2000/01/code-is-law-html."
"92KR93JS","The Right to Privacy","Warren, Samuel D.;Brandeis, Louis D.;","December 1890","digital privacy,policy","Warren and Brandeis, “The Right to Privacy.”","(Warren and Brandeis 1890)","Warren, Samuel D., and Louis D. Brandeis. “The Right to Privacy.” Louis D. Brandeis School of Law Library, December 1890. https://louisville.edu/law/library/special-collections/the-louis-d.-brandeis-collection/the-right-to-privacy."
"NJQE2BEQ","A Declaration of the Independence of Cyberspace","Barlow, John Perry;","February 8, 1996","Self-rule fallacy","Barlow, “A Declaration of the Independence of Cyberspace.”","(Barlow 1996)","Barlow, John Perry. “A Declaration of the Independence of Cyberspace.” Electronic Frontier Foundation, February 8, 1996. https://www.eff.org/cyberspace-independence."
"FI4VW6JS","A Nobel-winning economist’s guide to taming tech monopolies","Schrager, Allison;","June 27, 2018","platform monopolies","Schrager, “A Nobel-Winning Economist’s Guide to Taming Tech Monopolies.”","(Schrager 2018)","Schrager, Allison. “A Nobel-Winning Economist’s Guide to Taming Tech Monopolies.” Quartz, June 27, 2018. https://qz.com/1310266/nobel-winning-economist-jean-tirole-on-how-to-regulate-tech-monopolies/."
"V9WCFW9K","The costs of connection: how data is colonizing human life and appropriating it for capitalism","Couldry, Nick;Mejias, Ulises Ali;","2019","Capitalism,Electronic data processing,Information technology,Internet,Social aspects","Couldry and Mejias, _The Costs of Connection_.","(Couldry and Mejias 2019)","Couldry, Nick, and Ulises Ali Mejias. _The Costs of Connection: How Data Is Colonizing Human Life and Appropriating It for Capitalism_. Culture and Economic Life. Stanford, California: Stanford University Press, 2019."
"F2PFPHQE","Beyond surveillance capitalism: Privacy, regulation and big data in Europe and China","Aho, Brett;Duffield, Roberta;","May 4, 2020","GDPR,big data,data privacy,data regulation,social credit system,surveillance capitalism","Aho and Duffield, “Beyond Surveillance Capitalism.”","(Aho and Duffield 2020)","Aho, Brett, and Roberta Duffield. “Beyond Surveillance Capitalism: Privacy, Regulation and Big Data in Europe and China.” _Economy and Society_ 0, no. 0 (May 4, 2020): 1–26. https://doi.org/10.1080/03085147.2019.1690275."
"CKHJ239J","The datafication of teaching in Higher Education: critical issues and perspectives","Williamson, Ben;Bayne, Sian;Shay, Suellen;","May 18, 2020","","Williamson, Bayne, and Shay, “The Datafication of Teaching in Higher Education.”","(Williamson, Bayne, and Shay 2020)","Williamson, Ben, Sian Bayne, and Suellen Shay. “The Datafication of Teaching in Higher Education: Critical Issues and Perspectives.” _Teaching in Higher Education_ 25, no. 4 (May 18, 2020): 351–65. https://doi.org/10.1080/13562517.2020.1748811."
"WFN34D9V","Digital Dead Body Management (DDBM): Time to Think it Through","Sandvik, Kristin Bergtora;","","","Sandvik, “Digital Dead Body Management (DDBM).”","(Sandvik n.d.)","Sandvik, Kristin Bergtora. “Digital Dead Body Management (DDBM): Time to Think It Through.” _Journal of Human Rights Practice_. Accessed May 11, 2020. https://doi.org/10.1093/jhuman/huaa002."
"H2MA759Z","Investigating Ad Transparency Mechanisms in Social
Media: A Case Study of Facebook’s Explanations",,"2018","","“Investigating Ad Transparency Mechanisms in Social: A Case Study of Facebook’s Explanations.”","(“Investigating Ad Transparency Mechanisms in Social: A Case Study of Facebook’s Explanations” 2018)","“Investigating Ad Transparency Mechanisms in Social: A Case Study of Facebook’s Explanations,” 2018. https://people.mpi-s."
"TM4JHSA2","Time for change and transparency in programmatic advertising","Ltd, Dock9;","","","Ltd, “Time for Change and Transparency in Programmatic Advertising.”","(Ltd n.d.)","Ltd, Dock9. “Time for Change and Transparency in Programmatic Advertising.” ISBA. Accessed May 6, 2020. https://www.isba.org.uk/news/time-for-change-and-transparency-in-programmatic-advertising/."
"ZH4NHQQD","Regulating Transparency? Facebook, Twitter and the German
Network Enforcement Act",,"2020","","“Regulating Transparency? Facebook, Twitter and the German Enforcement Act.”","(“Regulating Transparency? Facebook, Twitter and the German Enforcement Act” 2020)","“Regulating Transparency? Facebook, Twitter and the German Enforcement Act,” 2020. https://dl.acm.org/doi/pdf/10.1145/3351095.3372856."
"4PCVRSEH","No more negotiating: new rules could finally force Google and Facebook to pay for news","Kemp, Katharine;Nicholls, Rob;","","","Kemp and Nicholls, “No More Negotiating.”","(Kemp and Nicholls n.d.)","Kemp, Katharine, and Rob Nicholls. “No More Negotiating: New Rules Could Finally Force Google and Facebook to Pay for News.” The Conversation. Accessed May 3, 2020. http://theconversation.com/no-more-negotiating-new-rules-could-finally-force-google-and-facebook-to-pay-for-news-136718."
"G23DMDFH","Tactical agency? Young people’s (dis)engagement with WhatsApp and Facebook Messenger:","Gangneux, Justine;","April 22, 2020","","Gangneux, “Tactical Agency?”","(Gangneux 2020)","Gangneux, Justine. “Tactical Agency? Young People’s (Dis)Engagement with WhatsApp and Facebook Messenger:” _Convergence_, April 22, 2020. https://doi.org/10.1177/1354856520918987."
"BPCTF4S9","The Black Box and Japanese Discourses of the Digital","Humphrey, David;","2020/04/13","B-CAS,DRM,Japan,black box,control,digital,digital broadcast,intellectual property,opacity,television","Humphrey, “The Black Box and Japanese Discourses of the Digital.”","(Humphrey 2020)","Humphrey, David. “The Black Box and Japanese Discourses of the Digital.” _International Journal of Communication_ 14, no. 0 (April 13, 2020): 17. https://ijoc.org/index.php/ijoc/article/view/13621."
"Q9BER3WX","Political participation in the digital age: an ethnographic comparison between Iceland and Germany","Tiemann-Kollipost, Julia;","2020","","Tiemann-Kollipost, _Political Participation in the Digital Age_.","(Tiemann-Kollipost 2020)","Tiemann-Kollipost, Julia. _Political Participation in the Digital Age: An Ethnographic Comparison between Iceland and Germany_. Digitale Gesellschaft, volume 25. Bielefeld: Transcript, 2020."
"F4MCFJBT","Digital Disinformation and the Imaginative Dimension of Communication","Cabañes, Jason Vincent A.;","2020-04-17","","Cabañes, “Digital Disinformation and the Imaginative Dimension of Communication.”","(Cabañes 2020)","Cabañes, Jason Vincent A. “Digital Disinformation and the Imaginative Dimension of Communication.” _Journalism & Mass Communication Quarterly_, April 17, 2020, 107769902091379. https://doi.org/10.1177/1077699020913799."
"JH4PG7IT","Technocracy Meets Populism: The Dominant Technological Imaginary of Silicon Valley","Ferrari, Elisabetta;","2020/04/29","","Ferrari, “Technocracy Meets Populism.”","(Ferrari 2020)","Ferrari, Elisabetta. “Technocracy Meets Populism: The Dominant Technological Imaginary of Silicon Valley.” _Communication, Culture and Critique_ 13, no. 1 (April 29, 2020): 121–24. https://doi.org/10.1093/ccc/tcz051."
"RF72CBIH","The Impacts of AdTech on Privacy Rights and the Rule of Law","Costello, Róisín Áine;","2020/04/14","Adtech data brokers autonomy privacy","Costello, “The Impacts of AdTech on Privacy Rights and the Rule of Law.”","(Costello 2020)","Costello, Róisín Áine. “The Impacts of AdTech on Privacy Rights and the Rule of Law.” _Technology and Regulation_, April 14, 2020, 11–23. https://techreg.org/index.php/techreg/article/view/37."
"VDFQZVGK","‘For good measure’: data gaps in a big data world","Giest, Sarah;Samuels, Annemarie;","2020-04-22","","Giest and Samuels, “‘For Good Measure.’”","(Giest and Samuels 2020)","Giest, Sarah, and Annemarie Samuels. “‘For Good Measure’: Data Gaps in a Big Data World.” _Policy Sciences_, April 22, 2020. https://doi.org/10.1007/s11077-020-09384-1."
"4T358S2T","The Soap Box as a Black Box: Regulating transparency in social media recommender systems","Leerssen, Paddy;","2020-03-19","","Leerssen, “The Soap Box as a Black Box.”","(Leerssen 2020)","Leerssen, Paddy. “The Soap Box as a Black Box: Regulating Transparency in Social Media Recommender Systems.” Preprint. LawArXiv, March 19, 2020. https://doi.org/10.31228/osf.io/uhxcv."
"2UA23ZDT","Platform ad archives: promises and pitfalls","Leerssen, Paddy;Ausloos, Jef;Zarouali, Brahim;Helberger, Natali;Vreese, Claes H. de;","2019/10/9","","Leerssen et al., “Platform Ad Archives.”","(Leerssen et al. 2019)","Leerssen, Paddy, Jef Ausloos, Brahim Zarouali, Natali Helberger, and Claes H. de Vreese. “Platform Ad Archives: Promises and Pitfalls.” _Internet Policy Review_ 8, no. 4 (October 9, 2019). https://policyreview.info/articles/analysis/platform-ad-archives-promises-and-pitfalls."
"4FCTCDQ8","Ad Delivery Algorithms: The Hidden Arbiters of Political Messaging","Ali, Muhammad;Sapiezynski, Piotr;Korolova, Aleksandra;Mislove, Alan;Rieke, Aaron;","2019-12-17","Computer Science - Computers and Society","Ali et al., “Ad Delivery Algorithms.”","(Ali et al. 2019)","Ali, Muhammad, Piotr Sapiezynski, Aleksandra Korolova, Alan Mislove, and Aaron Rieke. “Ad Delivery Algorithms: The Hidden Arbiters of Political Messaging.” _ArXiv:1912.04255 \[Cs\]_, December 17, 2019. http://arxiv.org/abs/1912.04255."
"HK6C5GRP","Discrimination through optimization: How Facebook's ad delivery can lead to skewed outcomes","Ali, Muhammad;Sapiezynski, Piotr;Bogen, Miranda;Korolova, Aleksandra;Mislove, Alan;Rieke, Aaron;","2019-11-07","Computer Science - Computers and Society","Ali et al., “Discrimination through Optimization.”","(Ali et al. 2019)","Ali, Muhammad, Piotr Sapiezynski, Miranda Bogen, Aleksandra Korolova, Alan Mislove, and Aaron Rieke. “Discrimination through Optimization: How Facebook’s Ad Delivery Can Lead to Skewed Outcomes.” _Proceedings of the ACM on Human-Computer Interaction_ 3, no. CSCW (November 7, 2019): 1–30. https://doi.org/10.1145/3359301."
"XETIFBDJ","Toward Trustworthy AI Development: Mechanisms for Supporting Verifiable Claims","Brundage, Miles;Avin, Shahar;Wang, Jasmine;Belfield, Haydn;Krueger, Gretchen;Hadfield, Gillian;Khlaaf, Heidy;Yang, Jingying;Toner, Helen;Fong, Ruth;Maharaj, Tegan;Koh, Pang Wei;Hooker, Sara;Leung, Jade;Trask, Andrew;Bluemke, Emma;Lebensold, Jonathan;O'Keefe, Cullen;Koren, Mark;Ryffel, Théo;Rubinovitz, J. B.;Besiroglu, Tamay;Carugati, Federica;Clark, Jack;Eckersley, Peter;de Haas, Sarah;Johnson, Maritza;Laurie, Ben;Ingerman, Alex;Krawczuk, Igor;Askell, Amanda;Cammarota, Rosario;Lohn, Andrew;Krueger, David;Stix, Charlotte;Henderson, Peter;Graham, Logan;Prunkl, Carina;Martin, Bianca;Seger, Elizabeth;Zilberman, Noa;hÉigeartaigh, Seán Ó;Kroeger, Frens;Sastry, Girish;Kagan, Rebecca;Weller, Adrian;Tse, Brian;Barnes, Elizabeth;Dafoe, Allan;Scharre, Paul;Herbert-Voss, Ariel;Rasser, Martijn;Sodhani, Shagun;Flynn, Carrick;Gilbert, Thomas Krendl;Dyer, Lisa;Khan, Saif;Bengio, Yoshua;Anderljung, Markus;","2020-04-20","Computer Science - Computers and Society","Brundage et al., “Toward Trustworthy AI Development.”","(Brundage et al. 2020)","Brundage, Miles, Shahar Avin, Jasmine Wang, Haydn Belfield, Gretchen Krueger, Gillian Hadfield, Heidy Khlaaf, et al. “Toward Trustworthy AI Development: Mechanisms for Supporting Verifiable Claims.” _ArXiv:2004.07213 \[Cs\]_, April 20, 2020. http://arxiv.org/abs/2004.07213."
"GEK68DB6","Do deepfakes pose a golden opportunity? Considering whether English law should adopt California's publicity right in the age of the deepfake","Farish, Kelsey;","2020/01/01","","Farish, “Do Deepfakes Pose a Golden Opportunity?”","(Farish 2020)","Farish, Kelsey. “Do Deepfakes Pose a Golden Opportunity? Considering Whether English Law Should Adopt California’s Publicity Right in the Age of the Deepfake.” _Journal of Intellectual Property Law & Practice_ 15, no. 1 (January 1, 2020): 40–48. https://doi.org/10.1093/jiplp/jpz139."
"2C8ZGU2U","Data Cooperatives: Towards a Foundation for Decentralized Personal Data Management","Hardjono, Thomas;Pentland, Alex;","2019-05-21","Computer Science - Computers and Society,Computer Science - Social and Information Networks","Hardjono and Pentland, “Data Cooperatives.”","(Hardjono and Pentland 2019)","Hardjono, Thomas, and Alex Pentland. “Data Cooperatives: Towards a Foundation for Decentralized Personal Data Management.” _ArXiv:1905.08819 \[Cs\]_, May 21, 2019. http://arxiv.org/abs/1905.08819."
"2WGJGM53","Digital colonialism: US empire and the new imperialism in the Global South","Kwet, Michael;","April 1, 2019","","Kwet, “Digital Colonialism.”","(Kwet 2019)","Kwet, Michael. “Digital Colonialism: US Empire and the New Imperialism in the Global South.” _Race & Class_ 60, no. 4 (April 1, 2019): 3–26. https://doi.org/10.1177/0306396818823172."
"T4V5C298","Tribal Data Governance and Informational Privacy: Constructing 'Indigenous Data Sovereignty'","Tsosie, Rebecca A.;","2019/09/16","environmental data,health data,indigenous data sovereignty,informational privacy,law enforcement data,nation-building,tribal governments","Tsosie, “Tribal Data Governance and Informational Privacy.”","(Tsosie 2019)","Tsosie, Rebecca A. “Tribal Data Governance and Informational Privacy: Constructing ‘Indigenous Data Sovereignty.’” SSRN Scholarly Paper. Rochester, NY: Social Science Research Network, September 16, 2019. https://papers.ssrn.com/abstract=3454632."
"P9FDRGZT","Oil is the New Data",,"","","“Oil Is the New Data.”","(“Oil Is the New Data” n.d.)","Logic Magazine. “Oil Is the New Data.” Accessed April 28, 2020. https://logicmag.io/nature/oil-is-the-new-data/."
"3DG5KXUB","All data are local: thinking critically in a data-driven society","Loukissas, Yanni A.;","2019","Electronic information resource literacy,Media literacy","Loukissas, _All Data Are Local_.","(Loukissas 2019)","Loukissas, Yanni A. _All Data Are Local: Thinking Critically in a Data-Driven Society_. Cambridge, Massachusetts: The MIT Press, 2019."
"9I35N839","Infrastructural surveillance:","Gekker, Alex;Hind, Sam;","October 10, 2019","","Gekker and Hind, “Infrastructural Surveillance.”","(Gekker and Hind 2019)","Gekker, Alex, and Sam Hind. “Infrastructural Surveillance:” _New Media & Society_, October 10, 2019. https://doi.org/10.1177/1461444819879426."
"XJAFFTHN","The Outrage of Networks: Social Media and Contemporary Authoritarian Populism | Democratic Communiqué",,"","","“The Outrage of Networks.”","(“The Outrage of Networks: Social Media and Contemporary Authoritarian Populism | Democratic Communiqué” n.d.)","“The Outrage of Networks: Social Media and Contemporary Authoritarian Populism | Democratic Communiqué.” Accessed April 28, 2020. https://journals.flvc.org/demcom/article/view/108905."
"ZU5GEE9N","Filtering: A Theory and History of a Style","Dango, Michael;","2020-04-10","","Dango, “Filtering.”","(Dango 2020)","Dango, Michael. “Filtering: A Theory and History of a Style.” _New Literary History_ 51, no. 1 (April 10, 2020): 177–207. https://doi.org/10.1353/nlh.2020.0007."
"PV9GZDIC","Nothing to disconnect from? Being singular plural in an age of machine learning","Bucher, Taina;","April 8, 2020","","Bucher, “Nothing to Disconnect From?”","(Bucher 2020)","Bucher, Taina. “Nothing to Disconnect from? Being Singular Plural in an Age of Machine Learning.” _Media, Culture & Society_, April 8, 2020, 0163443720914028. https://doi.org/10.1177/0163443720914028."
"RF9MWNV8","The new information feudalism: Africa’s relationship with the global information society","Ayodele, Odilile;","April 20, 2020","Africa,Information society,feudalism,intellectual property,property rights,telecommunications","Ayodele, “The New Information Feudalism.”","(Ayodele 2020)","Ayodele, Odilile. “The New Information Feudalism: Africa’s Relationship with the Global Information Society.” _South African Journal of International Affairs_ 0, no. 0 (April 20, 2020): 1–21. https://doi.org/10.1080/10220461.2020.1750470."
"Z4DTGG6A","Automation and Workers: Re-Imagining the Income Tax for the Digital Age","Li, Jinyan;Choi, Arjin;Smith, Cameron;","2020","Automation,capital,democracy,gig workers,labour,tax equity","Li, Choi, and Smith, “Automation and Workers.”","(Li, Choi, and Smith 2020)","Li, Jinyan, Arjin Choi, and Cameron Smith. “Automation and Workers: Re-Imagining the Income Tax for the Digital Age.” _Canadian Tax Journal_ 68, no. 1 (2020): 99–124. https://ideas.repec.org/a/ctf/journl/v68y2020i1p99-124.html."
"ANK67I5C","Labour law and the gig economy: challenges posed by the digitalisation of labour processes","Mella Méndez, Lourdes;Carby-Hall, Jo;","2020","Effect of technological innovations on,Independent contractors,Labor laws and legislation,Labor supply,Legal status, laws, etc,Self-employed,Temporary employees","Mella Méndez and Carby-Hall, _Labour Law and the Gig Economy_.","(Mella Méndez and Carby-Hall 2020)","Mella Méndez, Lourdes, and Jo Carby-Hall, eds. _Labour Law and the Gig Economy: Challenges Posed by the Digitalisation of Labour Processes_. Abingdon, Oxon ; New York, NY: Routledge, 2020."
"TAD73AB8","Harnessing Platform Envelopment in the Digital World","Condorelli, Daniele;Padilla, Jorge;","","","Condorelli and Padilla, “Harnessing Platform Envelopment in the Digital World.”","(Condorelli and Padilla n.d.)","Condorelli, Daniele, and Jorge Padilla. “Harnessing Platform Envelopment in the Digital World.” _Journal of Competition Law & Economics_. Accessed April 27, 2020. https://doi.org/10.1093/joclec/nhaa006."
"QVZQ8K2C","Double harm to voters: data-driven micro-targeting and democratic public discourse","Bayer, Judit;","2020/3/31","","Bayer, “Double Harm to Voters.”","(Bayer 2020)","Bayer, Judit. “Double Harm to Voters: Data-Driven Micro-Targeting and Democratic Public Discourse.” _Internet Policy Review_ 9, no. 1 (March 31, 2020). https://policyreview.info/articles/analysis/double-harm-voters-data-driven-micro-targeting-and-democratic-public-discourse."
"7MANH6NN","Big other: Surveillance Capitalism and the Prospects of an Information Civilization:","Zuboff, Shoshana;","March 1, 2015","","Zuboff, “Big Other.”","(Zuboff 2015)","Zuboff, Shoshana. “Big Other: Surveillance Capitalism and the Prospects of an Information Civilization:” _Journal of Information Technology_, March 1, 2015. https://doi.org/10.1057/jit.2015.5."
"I9ARVCJD","Blocking information on COVID-19 can fuel the spread of misinformation","Larson, Heidi J.;","2020-03-30","","Larson, “Blocking Information on COVID-19 Can Fuel the Spread of Misinformation.”","(Larson 2020)","Larson, Heidi J. “Blocking Information on COVID-19 Can Fuel the Spread of Misinformation.” _Nature_ 580, no. 7803 (March 30, 2020): 306–306. https://doi.org/10.1038/d41586-020-00920-w."
"F6XBK5AS","Social-media companies must flatten the curve of misinformation","Donovan, Joan;","2020-04-14","","Donovan, “Social-Media Companies Must Flatten the Curve of Misinformation.”","(Donovan 2020)","Donovan, Joan. “Social-Media Companies Must Flatten the Curve of Misinformation.” _Nature_, April 14, 2020. https://doi.org/10.1038/d41586-020-01107-z."
"PZAAAUH6","Trollthrottle -- Raising the Cost of Astroturfing","Esiyok, Ilkan;Hanzlik, Lucjan;Kuennemann, Robert;Budde, Lena Marie;Backes, Michael;","2020-04-19","Computer Science - Cryptography and Security","Esiyok et al., “Trollthrottle -- Raising the Cost of Astroturfing.”","(Esiyok et al. 2020)","Esiyok, Ilkan, Lucjan Hanzlik, Robert Kuennemann, Lena Marie Budde, and Michael Backes. “Trollthrottle -- Raising the Cost of Astroturfing.” _ArXiv:2004.08836 \[Cs\]_, April 19, 2020. http://arxiv.org/abs/2004.08836."
"AA5IVVAG","Want to Find a Misinformed Public? Facebook’s Already Done It – The Markup","Sankin, Aaron;","April 23, 2020","ads,disinformation","Sankin, “Want to Find a Misinformed Public?”","(Sankin 2020)","Sankin, Aaron. “Want to Find a Misinformed Public? Facebook’s Already Done It – The Markup.” The Markup, April 23, 2020. https://themarkup.org/coronavirus/2020/04/23/want-to-find-a-misinformed-public-facebooks-already-done-it."
"PG4N7QNU","Economic Resources, Mortality and Inequality","Attanasio, Orazio;Nielsen, Torben Heien;","2020/03/03","Economic Resources and Inequality,Mortality,Permanent Income","Attanasio and Nielsen, “Economic Resources, Mortality and Inequality.”","(Attanasio and Nielsen 2020)","Attanasio, Orazio, and Torben Heien Nielsen. “Economic Resources, Mortality and Inequality.” SSRN Scholarly Paper. Rochester, NY: Social Science Research Network, March 3, 2020. https://papers.ssrn.com/abstract=3553731."